{
  "$schema": "./schema.json",
  "antetSatirlari": [
    "T.C.",
    "SAĞLIK BAKANLIĞI",
    "Ankara İl Sağlık Müdürlüğü",
    "Destek Hizmetleri Başkanlığı"
  ],
  "evrakSayisi": "12345",
  "dosyaKonusu": "Son Alım Fiyat Cetveli",
  "tarih": "28.06.2026",
  "kurumIci": true,
  "kurumAdres": "Mustafa Kemal Mah. Dumlupınar Blv. No:1 Çankaya/Ankara",
  "kurumTelefon": "0312 555 44 33",
  "kurumWeb": "www.saglik.gov.tr",
  "kurumEposta": "ankara.destek@saglik.gov.tr",
  "kurumKep": "saglikbakanligi@hs01.kep.tr",
  "hazirlayanPersonelAdi": "Ayşe Demir",
  "hazirlayanPersonelUnvan": "V.H.K.İ.",
  "kontrolEdenPersonelAdi": "Ali Yılmaz",
  "kontrolEdenPersonelUnvan": "Satın Alma Sorumlusu",
  "solLogo": "https://raw.githubusercontent.com/ilyasbozdemir/workdesk-360/main/public/icon.png",
  "sagLogo": "https://upload.wikimedia.org/wikipedia/commons/0/0f/Logo_of_100th_years_of_the_Republic_of_T%C3%BCrkiye.svg",
  "fiyatKalemleri": [
    {
      "siraNo": 1,
      "malzemeKodu": "LAB-001",
      "malzemeAdi": "Eldiven",
      "ozelligi": "Nitril",
      "birimi": "Kutu",
      "kdvOrani": "20",
      "miktar": 50,
      "birimFiyat": "125,00",
      "toplamTutar": "6.250,00",
      "kazananFirma": "ABC Medikal Ltd.",
      "alimTarihi": "10.01.2026"
    },
    {
      "siraNo": 2,
      "malzemeKodu": "LAB-002",
      "malzemeAdi": "Maske",
      "ozelligi": "N95",
      "birimi": "Adet",
      "kdvOrani": "10",
      "miktar": 200,
      "birimFiyat": "45,00",
      "toplamTutar": "9.000,00",
      "kazananFirma": "Sağlık Malz. A.Ş.",
      "alimTarihi": "15.02.2026"
    },
    {
      "siraNo": 3,
      "malzemeKodu": "LAB-005",
      "malzemeAdi": "Enjektör",
      "ozelligi": "5 ml",
      "birimi": "Adet",
      "kdvOrani": "10",
      "miktar": 500,
      "birimFiyat": "3,50",
      "toplamTutar": "1.750,00",
      "kazananFirma": "Medikal Plus",
      "alimTarihi": "20.03.2026"
    }
  ],
  "genelToplam": "17.000,00",
  "olurYazisi": true,
  "dosyaTarihi": "28.06.2026",
  "onaylayanPersonelAdi": "Dr. Mehmet Demir",
  "onaylayanPersonelUnvan": "İl Sağlık Müdürü",
  "hazirlayanTelefon": "0312 555 44 33",
  "hazirlayanEposta": "hazirlayan@kurum.gov.tr"
}
